URL,TITLE,TEXT,LEFT CONTEXT,RIGHT CONTEXT
https://www.reddit.com/r/costarica/comments/14y1mxr/gentrification_of_costa_rica_and_tourism_vs_travel/,Gentrification of Costa Rica and tourism vs travel,"Let’s get this out of the way first, im an Indian, I did a large amount of research before I came to visit for 2 weeks. I speak some Spanish. 

All in all, im pretty disappointed because CR is advertised extensively and has the image of being this amazing utopia. I came here to immerse myself with my broken Spanish and love for Central American food and people.

All I found here is a bunch of foreigners, let’s just say light skinned eh? Who have pura vida tattoos and a drinking problem on the coastal areas and adrenaline junkies on the other parts. 

The Ticos don’t seem to happy with the likes of these, and I get it, I wouldn’t be either considering again, that im Indian and I know what it feels like when a bunch of white people come to my country and make everything expensive and inaccessible to locals at the same time being patronizing. 

The gentrification here is driving me nuts and I don’t know how the Ticos deal. Then I see posts about some more Gringos wanting to move here for good and putting the housing market through the grater for locals just as it’s ruined in their “first world” economies.

I guess this is just a rant, just to say, beautiful country, filled with great locals, hope you get to retain your country and culture, hope you can afford to live comfortably. And before everyone goes “oh Costa Ricans are also immigrants from way back bla bla bla” shut up. Ok thanks. Gentrification is a beech.",[''],"['Costa', 'Rica', 'and', 'tourism']"
https://i.redd.it/m54ek349194b1.png,Added a swimming pool and countered those dragons with some fighter jets. Let the gentrification of Faram commence!,,"['fighter', 'jets.', 'Let', 'the']","['Faram', 'commence!']"
https://www.theguardian.com/world/2023/jun/27/here-is-the-history-the-life-the-shrine-holding-out-against-the-gentrification-of-bangkok,"‘Here is the history, the life’: the shrine holding out against the gentrification of Bangkok",,"['holding', 'out', 'against', 'the']",['Bangkok']
https://www.nber.org/papers/w31480#fromrss,"Household Mobility, Networks, and Gentrification of Minority Neighborhoods in the US -- by Fernando V. Ferreira, Jeanna H. Kenney, Benjamin Smith",,"['Household', 'Mobility', 'Networks', 'and']","['Minority', 'Neighborhoods', 'in', 'the']"
https://www.reddit.com/r/bristol/comments/13rcsh0/the_gentrification_of_easton/,The gentrification of Easton,"No sign of the Cost of Living Crisis here.  Whilst the born and bred of Easton struggle to eat and pay bills, the new comers continue to buy victorian terraces at vastly inflated prices AND then shell out seemingly endless £££££s to renovate the property.",['The'],['Easton']
https://www.reddit.com/r/boston/comments/140rm8t/feeling_the_gentrification_of_the_clown_district/,Feeling the gentrification of the clown district today…,"The clown district along  south st near diner  has all closed down and  we are really feeling the loss of clown emporium off rt9 in Wellsely. I was hoping to go to mobile clown fair in Watertown but the A trolley never came when I waited for it at the Cadillac dealership on commonwealth avenue all I saw was the B. Any ideas where someone can get a bespoke clown costume in short notice?

Anyone remember the clown district? Gentrification is really destroying the character of the city. Such great stores; Shoes and things, Clown center, bradlees. At the end of the day shopping  you and the family  could pick up a raspberry muffin that would put Jordan marsh to shame.","['Feeling', 'the']","['the', 'clown', 'district', 'today…']"
https://www.reddit.com/r/AskNYC/comments/13tmstl/besides_rent_and_col_what_are_the_worst_parts_of/,Besides rent and COL what are the worst parts of recent gentrification of the city in your opinion,"As someone who likes music, anime and geek culture. The scene here feels like there's less connection and passion in it, a lot more gimmicky and like it solely exists to sell you something.","['worst', 'parts', 'of', 'recent']","['the', 'city', 'in', 'your']"
https://i.redd.it/sxla2wy6k7oa1.jpg,Here goes the gentrification of the term code switching by none other than amanda bucci,,"['Here', 'goes', 'the']","['the', 'term', 'code', 'switching']"
https://www.reddit.com/gallery/1356v3d,the gentrification of workwear,,['the'],['workwear']
https://i.redd.it/7zaaujn6phoa1.jpg,I fell down the rabbit hole of “van life families” - it’s the lack of privacy and gentrification of homelessness for me…,,"['lack', 'of', 'privacy', 'and']","['homelessness', 'for', 'me…']"
https://i.imgur.com/uOxBj9H.png,Elves in my setting are on strike after the gentrification of the North Pole. Contributing factors include cheap gingerbread housing and the availability of manufacturing jobs.,,"['on', 'strike', 'after', 'the']","['the', 'North', 'Pole.', 'Contributing']"
https://www.pbs.org/video/mayor-newark-addresses-public-safety-and-gentrification-ymel/,"Mayor of Newark Addresses Public Safety and Gentrification - Newark Mayor Ras Baraka joins Steve Adubato to address public safety, the relationship between residents and police officers, and the ongoing gentrification of Newark.",,"['officers', 'and', 'the', 'ongoing']",['Newark.']
https://v.redd.it/apksd4kcsnu91,"I present to you, the COMPLETE deforestation and gentrification of Cindersap Forest >:)",,"['the', 'COMPLETE', 'deforestation', 'and']","['Cindersap', 'Forest', '>:)']"
https://i.redd.it/n4xphvypl77b1.png,"*sigh* once again stealing our memes not epic, the gentrification of robot juice is here folks :/",,"['memes', 'not', 'epic', 'the']","['robot', 'juice', 'is', 'here']"
https://i.redd.it/kn14ho12hp3b1.jpg,The gentrification of Tatooine,,['The'],['Tatooine']
https://7tv.app/emotes/6375784658ccb5a6d32c0d28,When will you make a public statement on the blatant gentrification of our community?,,"['statement', 'on', 'the', 'blatant']","['our', 'community?']"
https://www.reddit.com/r/jambands/comments/13sldjy/gentrification_of_planet_earth/,Gentrification of Planet Earth!!!,"Greetings earthlings!

I know it's kinda frowned upon to self-promote on reddit, and I really haven't before but I've poured the last 5 years of my heart, passion, and creativity into this album and while the press hasn't really come through for us on this release, I'm confident that y'all beautiful people can help us get some streams.

For those new to our sound, we've been compared to the likes of Turkuaz and Thumpasaurus and have been described as Zappa meets OutKast. The new album is campy horror allegory with Lovecraftian imagery and ferocious rap-rock tones. If you want to dip your toe in I'd suggest the tracks: Multi-Dimensional Space Kraken, Spooky Food, Gentrification of Planet Earth, or Abortable Housing.

Thanks for listening and if you're in Austin we're playing our release/farewell show at Parish tonight at 8pm.

Best,

Squiggly Finesse of Bourgeois Mystics",[''],"['Planet', 'Earth!!!']"
https://www.latimes.com/opinion/letters-to-the-editor/story/2023-06-02/congestion-pricing-gentrification-of-the-roads-or-the-obvious-traffic-fix,"[Op-Ed] - Letters to the Editor: Is congestion pricing 'gentrification of the roads,' or the obvious traffic fix? | LA Times",,"['Is', 'congestion', 'pricing', '']","['the', 'roads', 'or', 'the']"
https://www.youtube.com/watch?v=KyDgX7Z4u2A,Is Mental Illness an Accessory? The Gentrification of Disability Debate. (Bomb Squad Psych Podcast),,"['Illness', 'an', 'Accessory?', 'The']","['Disability', 'Debate.', '(Bomb', 'Squad']"
https://i.redd.it/a6e074lc3ona1.jpg,"Our council approved of this monstrosity and three other more that will contribute furthermore to the gentrification of our beautiful Málaga, bringing more rich remote workers.",,"['contribute', 'furthermore', 'to', 'the']","['our', 'beautiful', 'Málaga', 'bringing']"
https://www.reddit.com/gallery/13ernui,"Suburb Outcast (from upcoming set ""Gentrification of Dominaria"")",,"['(from', 'upcoming', 'set', '']",['Dominaria)']
https://www.bathecho.co.uk/news/politics/concern-raised-people-without-id-vote-101198/?mc_cid=218d596e6f&mc_eid=cc667ae9f4,The gentrification of democracy,,['The'],['democracy']
https://www.latimes.com/opinion/letters-to-the-editor/story/2023-06-02/congestion-pricing-gentrification-of-the-roads-or-the-obvious-traffic-fix,"[Op-Ed] - Letters to the Editor: Is congestion pricing 'gentrification of the roads,' or the obvious traffic fix?",,"['Is', 'congestion', 'pricing', '']","['the', 'roads', 'or', 'the']"
https://www.reddit.com/r/AutisticPeeps/comments/11m78o3/article_the_gentrification_of_disability_by/,Article: The Gentrification of Disability by Freddie deBoer,"I posted a quote from this article in another post but I thought it would be good to give the article its own post. In this post I have copied the first \~1/3 since it is about autism and the rest of the article is about mental illness (Freddie has bipolar).

The excerpt is long. I'm tempted to write a short summary so everyone can get the main idea, but I don't want to mess with Freddie's writing. If anyone would like a summary I will try.

[https://freddiedeboer.substack.com/p/the-gentrification-of-disability](https://freddiedeboer.substack.com/p/the-gentrification-of-disability)

>When I was in my late 20s (early 2007 to mid 2009, maybe) I worked for the local public school district in my hometown. For the bulk of my time there I was in a special program for kids with severe emotional disturbance, which I’ve written about once or twice. But I worked in a number of capacities in those years, and for a little while I helped out in a conventional special ed classroom for the middle school. I guess you’d say I was a paraprofessional, just extra coverage when they needed it.  
>  
>In that class there were two boys who had autism which resulted in severe academic and social and communicative impairments. One of them was completely nonverbal and had been his entire life. As I understood it, he had never been capable of speaking or reading, could not dress himself, wore sanitary garments, could not go to the bathroom without assistance. He would occasionally screech very loudly, without clear cause. I believe these days he would be referred to as having Level Three autism, as defined by the DSM. He needed a lot of help, and though he was unable to complete what might conventionally be called academic work the school provided him with structure, support, and time during which his mother didn’t have to care for him. I met her on several occasions when she came to pick him up after school. She would sometimes talk about the difficulties of raising a disabled child in language that would be frowned on today, but I admired how frank and honest she was.  
>  
>She was really not a fan of the autism awareness community of the time. This was well before the “neurodiversity” movement and all of its habits. It was all about awareness, raising awareness, 5ks for awareness, bumper stickers for awareness. That was precisely what angered her the most. She said to me once, “What does awareness do for my kid? How does it help me?” Words to that effect. It was a good question, one I couldn’t answer. Today I don’t hear about awareness so much, but there’s still plenty of the basic disease of awareness thinking - the notion that what people who deal with a particular disability need is a vague positivity, that what every disabled person requires is the laurel of strangers condescendingly wishing them the best. Now, with the rise of neurodiversity and the notion that autism is only different, not worse, we are confronted with similar questions. When a mother struggles every day to care for someone who will likely never be able to care for himself, what value could it hold for her that his condition is called diversity, rather than disorder? What value can it have for him, who cannot speak to comment on the difference?  
>  
>I thought of that mother when I read about [the recent cancelation of an academic panel at Harvard](https://www.thecrimson.com/article/2022/5/4/beth-israel-autism-panel-backlash/). It seems a panel of experts was slated to speak on the subject of how best to help those with autism. But as they planned to speak about treatment, about treating autism as a hindrance to be managed, the event was decried as “violently ableist” by Harvard activists and swiftly shut down. It’s worth looking at [the petition](https://www.change.org/p/demand-that-harvard-support-autistic-students?source_location=petitions_browse) that was organized as part of this effort. One part reads  
>  
>*Autism is a neurodevelopmental and neurobiological disability that is not treatable or curable. It is not an illness or disease and most importantly, it is not inherently negative. Autistic people at Harvard and globally have advocated in the face of ableism to defend ourselves from such hateful, eugenicist logic.*  
>  
>This is, I think, nonsensical. It asserts that autism is a disability, a dis-ability, but also that it’s not an illness, a disease, or inherently negative. But the very concept of disability depends on the notion that disabilities are inherently negative. If they are not in some sense disabling, the term has no meaning. What’s more, the entire moral and legal logic that underpins the concept of reasonable accommodation - the affordances we make for people with disabilities, mandated by the Americans with Disabilities Act - depends on the idea that these things are both unchosen and harmful. If they’re not, then there’s no communal obligation to accommodate them. What would they even need accommodation *for*?  
>  
>More, though, I cannot comprehend the arrogance of the woman who led the charge against the panel at Harvard, Kris King, to sit on her perch at the most exclusive university in the world and declare for the entire autistic community what autism is and means. It’s unsurprising that she’s disdainful of the need for treatment, given that she’s so high-functioning that she’s flourishing at an Ivy League university. She will never live the life that mother I knew lived. She will likely never care for someone whose autism has devastated them, robbed them of their ability to have conventional human relationships, to have a career, to be in love. Such debilitated people and their families will never have the cultural influence of a self-promoting Harvard student and so they’re simply read out of the conversation. Meanwhile autism activists and advocates make sweeping pronouncements about the lives of people they don’t know and could never understand.  
>  
>“Autistic people at Harvard and globally have advocated in the face of ableism to defend ourselves,” she writes. In fact, Ms. King, globally there are millions of people whose autism ensures they can’t advocate at all. Spare a thought for them, while you’re busy framing your diploma.  
>  
>In the years that followed my brief employment at the school district, the ideology that led to people like King was born. In the early 2010s there was a flurry of interest in autism. Dozens of books and hundreds of essays were written about autism, almost all of which talked about it as a set of valuable personality quirks rather than as a disorder. In article after ponderous article, autism was described as a newer, perhaps better way of thinking, sometimes even a “new evolution” for the human species. Always, always, always, this navel-gazing fixated relentlessly on the highest-functioning people with autism. You could read tens of thousands of words in this genre without ever once being informed about the *existence* of those whose autism debilitates them. Whenever I read yet another article talking about how some high-achieving computer scientist saw their autism as the key to their success, I would think of those whose autism has prevented them from enjoying all manner of elements of human life. Where were those people in all of that hype? Will Tyler Cowen ever write a book about them? Are they ever going to appear on the cover of *Forbes* magazine or whatever the fuck? No. They have been replaced; in their stead, we have members of the striving classes whose autism has never prevented them from flourishing at everything they’ve ever tried. And since “autism is not a disorder” has become the enforced opinion, those whose autism plainly *is* a disorder have to be marginalized - by the very people who complain about the marginalization of the “neurodiverse.” Autism has been gentrified.  
>  
>This is a dynamic I now cannot stop seeing: once a human attribute like autism or mental illness becomes seen as an identity marker that is useful for social positioning among the chattering class, the conversation about that attribute inevitably becomes fixated on those among that chattering class. It becomes impossible to escape their immense social gravity. The culture of that attribute becomes distorted and bent towards the interests and biases of those who enjoy the privilege of holding society’s microphone. Because you must be able to effectively communicate to take part in the conversation, and because all of the usual privileges of class and circumstance influence whose voice sounds the loudest, the discussion becomes just another playground for college-educated urbanites. To speak you must be able to speak, literally, and you must also enjoy the privileges of communicative competence and educated-class signaling mechanisms. So we will always tend toward a conversation that defaults to the interests of the least afflicted. This is inevitable; it’s baked into the system.  
>  
>We could overcome this problem if the people in the arena were dedicated to fronting (excuse me, “centering”) the interests of the most afflicted. But we can’t have that. We can’t have that because contemporary disability ideology is obsessively fixated on telling people to center themselves. That is perceived to be the entirety of the work: every individual with a disability must demand that the world sees them as “valid,” that they are just as authentically disabled as anyone else, that their ADHD grants them perfectly equal priority in receiving accommodation as someone who’s paralyzed from the neck down. The whole social culture of disability activism and studies is leveraged to support the individual’s demand for attention and proper respect; it cannot countenance the notion that there are those who we should put before ourselves. And the obvious impulse to say that someone who faces total debilitation from their disorder should, in fact, be a higher priority for the medical and therapeutic communities is treated as the height of bigotry.  
>  
>I am watching, in real time, as the same process of gentrification that overtook autism overtakes mental illness.","['Article:', 'The']","['Disability', 'by', 'Freddie', 'deBoer']"
https://www.reddit.com/r/SurreyBC/comments/yxx5ix/gentrification_of_whalley/,Gentrification of Whalley,"Anyone find the whole gentrificaruon of Whalley fascinating to watch.


I was looking at 2 bedroom condos for a friend in the area, had no idea they were going for 600k.

Crazy part was a home in my area sold for 650k like 4 years ago for that much, a rancher.",[''],['Whalley']
https://i.redd.it/7s5eyahcouea1.jpg,The bizarre and extremely bad taste gentrification of Rotterdam,,"['and', 'extremely', 'bad', 'taste']",['Rotterdam']
https://www.reddit.com/r/Dublin/comments/10vmlrp/thoughts_on_potential_gentrification_of_the/,Thoughts on potential gentrification of the entirety of Dublin city?,"If you had to hypothesize a means to do this, along what lines would it take?

Me personally?

I believe behaviour will follow thought, follow how we think.

Dublin definitely has a ""folksy"" charm, but if there were a way to maintain the common-people approachability of that, whilst improving its glamor?

Bear with me:

[https://vimeo.com/manage/videos/795820101](https://vimeo.com/manage/videos/795820101)

In theory this general ideology may be an example of what I mean, as it embodies a certain fun social component, but with an element of glamour to ensure standards don't deteriorate.

I think implementing such a societal ""thought paradigm"" would require improved AGS activity, but then of course that's already in the works.

More around the clock security, but of course with the reformed licencing laws, punters are staying out all night now anyway.

Additionally, as anti-social behavior is in many respects, bitches looking for attention (i.e. the non-progressive side to society looking for attention/validation in the face of the progressive side), **introduction or elevation in standard of a societal trade that facilitates learning of how to adequately manage that behaviour**

i.e. how to f\*\*k bitches.

Could revolutionize the ethos of the entire city, maybe even half the country.

Thoughts?","['Thoughts', 'on', 'potential']","['the', 'entirety', 'of', 'Dublin']"
https://www.reddit.com/gallery/u01rxm,The Gentrification of Sneakerhead Culture: An American Tragedy,,['The'],"['Sneakerhead', 'Culture:', 'An', 'American']"
https://i.redd.it/dsryo8wu7yma1.jpg,The start of gentrification of Manhattan (1994),,"['The', 'start', 'of']","['Manhattan', '(1994)']"
https://www.reddit.com/r/ukdrill/comments/z2og6z/do_you_think_regeneration_and_gentrification_of/,"Do you think regeneration and gentrification of the most deprived and crime-ridden areas in London e.g. Peckham, Brixton and Brick Lane area will see the decrease of gangs in the next 20 years?",[View Poll](https://www.reddit.com/poll/z2og6z),"['you', 'think', 'regeneration', 'and']","['the', 'most', 'deprived', 'and']"
https://academictimes.com/gentrification-may-emerge-because-rich-people-work-long-hours/,"Gentrification of inner city areas may be partly driven by the increasingly long hours of higher-income workers who move to city centers to cut commutes and demand less crime and more restaurants. The study found that by 1990, working longer hours became more common among the ""high-skilled"".",,[''],"['inner', 'city', 'areas', 'may']"
https://www.reddit.com/r/RealEstate/comments/11dtdmz/will_the_increased_pricing_in_houses_push/,Will the increased pricing in houses push gentrification of neighborhoods to move quicker?,I’m interested to hear what people think about this. I live in a LCOL area and I’ve watched several neighborhoods in my city clean themselves up over the past 20 yrs. Now with high earners working from home scooping up property here the dynamics of some neighborhoods will certainly shift. Thoughts?,"['pricing', 'in', 'houses', 'push']","['neighborhoods', 'to', 'move', 'quicker?']"
https://amp.cnn.com/cnn/2022/12/14/us/atlanta-police-cop-city-terrorism/index.html,TIL Gentrification of Atlanta is Leading to the development of a Cop City,"Basically, Cop City will be a developed area for Police to Practice Urban “Policing” (Warfare).

This is apart of the plan to displace PoC as Atlanta shifts to corporate interest of media production.",['TIL'],"['Atlanta', 'is', 'Leading', 'to']"
https://www.reddit.com/r/Urbanism/comments/11rmre0/how_does_the_integration_of_bluegreen/,How does the integration of Blue-Green Infrastructure in cities lead to the displacement or gentrification of communities?,"I'm currently working on preparing a development plan of an Indian city as a part of my academic project. Our broad approach was to increase the per capita public space by creating more parks and green buffers considering that the entire city lacks the minimum requirement of 9 sq.m. 

However I read this paper which says that there are cases where by integrating more green spaces in localised areas, the market price of the area increases which polarizes the affordability and therefore displaces communities. I'd like to gain more perspective on it.","['to', 'the', 'displacement', 'or']",['communities?']
https://www.reddit.com/r/BBQ/comments/wlptu2/gentrification_of_bbq/,Gentrification of BBQ,"I had to go to an doctor's office in Miami and traffic was insanely bad.  The GPS suggested a surface street route that was a bit of a tour of all of the bad ghettos in Miami, but I figured why not.  It's not the 80's anymore, and I figured it would be more interesting than bumper to bumper on the highway.

I leave Liberty City, drive through the neighborhood to the South and end up in a warehouse area.  I see a rusty building that houses some fruit markets, and I see a sign for BBQ.  I can see smoke rolling, it looked pretty legit, so I decided to go there for lunch.

Celebrity chef owned.  $20 for 8oz of brisket, $40 for a beef rib, charsiu baby back ribs $32.  A great wine list.

I had the brisket sandwich.  It was good, similar to chain bbq places but with gourmet bread at toppings, not remotely in the same ballpark as Franklin's or any decent bbq joint.",[''],['BBQ']
https://www.reddit.com/r/boston/comments/rbvxz8/disappointed_by_the_gentrification_of_kenmore/,Disappointed by the gentrification of kenmore square.,"Once upon a time kenmore square had so much local character, ihop, bertuccis, mcdonalds , GAP, a single shop that was a blockbuster/dunks/baskin robbins. You could even find a burger king and taco bell down the road in BU. Now we dont have anything. There is barely anyone yelling at me or asking for money. There is only one abandoned building in the area.  This is so disappointing and how a city loses character.","['Disappointed', 'by', 'the']","['kenmore', 'square.']"
