URL,TITLE,TEXT,LEFT CONTEXT,RIGHT CONTEXT
https://i.redd.it/0fmrv8uvc7ma1.png,"Once again we are seeing the gentrification of Robot Juice taking place, the seed is being taken away and spread",,"['we', 'are', 'seeing', 'the']","['Robot', 'Juice', 'taking', 'place']"
https://i.redd.it/jxaj8ux20ay91.jpg,It’s going to take a little longer for the gentrification of Willagee to be complete.,,"['little', 'longer', 'for', 'the']","['Willagee', 'to', 'be', 'complete.']"
https://www.reddit.com/r/Gent/comments/yubh3z/opinionscomplaints_on_gentrification_of_gent/,Opinions/complaints on gentrification of Gent,"Working class neighborhoods like the Dampoort, Brugse Poort, Ledeberg, Sleepstraat etc. are all gentrifying and tbh it’s kind of weird to me. Nobody but the (mostly flemish) upper class is benefiting from this while the rest of us are just trying to survive and pay our rent. 

The true Gentenaars don’t need a yoga studio or a expensive coffeeshop or a ultraliberal bookshop… especially not in the historically working class neighbourhoods that i’ve mentioned above. 

It’s also highly unfair for the working class people because we barely can afford living in Gent but the hipsters and gentrifiers can settle down anywhere from Sint Pieters to Muide… and the city is doing NOTHING to counter this inequality. While in other cities like Brussels and Antwerp many working class and POC people live in the centre, here in Gent we are mostly forced to live on the outer ring.","['Opinions/complaints', 'on']",['Gent']
https://i.imgur.com/LRGv52n.jpg,The Gentrification of Hove...,,['The'],['Hove...']
https://www.reddit.com/r/vermont/comments/s3ves5/the_gentrification_of_vermont/,The gentrification of Vermont,"Second generation Vermonter here, my wife is a fourth generation Vermonter. We make well over the median income, but have been blown away by how high houses are selling for. If it’s not a complete dump it’s listing at over 400k, places that sold for 250k a few years ago are listing for 500k or more. What are we doing about this? How will we protect our state from being overrun by millionaires? Good hard working people are being forced out of their rented places and others can’t afford to buy in the state they grew up in. We can’t let this state lose its soul.",['The'],['Vermont']
https://i.redd.it/hskppaf277ia1.png,"The gentrification of Robot Juice is happening, they're stealing our memes",,['The'],"['Robot', 'Juice', 'is', 'happening']"
https://i.redd.it/7s5sjzvw50x91.jpg,The gentrification of a local fest :(,,['The'],"['a', 'local', 'fest', ':(']"
https://menafn.com/1105563632/The-Fight-Between-Tate-Modern-And-Its-Wealthy-Neighbours-Reveals-The-Gentrification-Of-The-Skies&Social=on,The Fight Between Tate Modern And Its Wealthy Neighbours Reveals The Gentrification Of The Skies #MENAFN #LatestNews #BreakingNews,,"['Wealthy', 'Neighbours', 'Reveals', 'The']","['The', 'Skies', '#MENAFN', '#LatestNews']"
https://www.reddit.com/r/auckland/comments/wrx2zj/have_there_been_examples_of_reverse/,Have there been examples of reverse gentrification of a suburb in Auckland?,Have there been areas that have been left to abandon and gone backwards in the last 20 years. Areas that used to be considered decent that are now not that popular. Areas that have seen the opposite of gentrification.,"['been', 'examples', 'of', 'reverse']","['a', 'suburb', 'in', 'Auckland?']"
https://www.reddit.com/r/boston/comments/rchbln/activists_decry_gentrification_of_seaport/,Activists decry gentrification of seaport,"BOSTON — amidst a dusting of light snow, parking lot and warehouse enthusiasts have gathered in the seaport to protest the gentrification of the neighborhood.

Karen, a vegan from Somerville is appalled by the  environmental damage. “There was a whole habitat of plants and animals living in the old parking lots” she said, “and now it’s gone”.

Others were here for different reasons. “This is matter of equity”, says Kim, an activist from the south end.  Asked to elaborate she emphasized the loss of parking lots raised equity issues. 

Jim, unemployed from Wellesley spoke about the warehouses. “There was a whole community that gathered here. People see dilapidated buildings but it was more than that”. A child of the 80s, he continued “the condo developers can’t be stopped with a montage. This is real life”.

Among these protesters an unlikely ally. Luis a father of four and construction worker from Revere. “I just went to get coffee” he says, “can I go back to work?” , highlighting the displacement felt by the POC community.","['Activists', 'decry']",['seaport']
https://v.redd.it/9dn5w7ze1z281,The gentrification of homelessness,,['The'],['homelessness']
https://www.reddit.com/r/Mafia/comments/v3hxex/do_you_think_the_gentrification_of_nyc_has/,Do you think the gentrification of NYC has confused recently released mobsters?,"I just recently realized the shooter behind the Galante hit was recently released from prison. This isn't a guy who cooperated, so he wasn't relocated like Sammy The Bull or Michael Franzese, who ended up  out west. I just imagine a newly released wise guy walking around modern Brooklyn and seeing a ton of hipsters and being utterly fucking confused and dismayed.","['Do', 'you', 'think', 'the']","['NYC', 'has', 'confused', 'recently']"
https://v.redd.it/gij70n1r984a1,The left is somewhere between gross car glorification and gentrification of r/urbancarliving,,"['gross', 'car', 'glorification', 'and']",['r/urbancarliving']
https://v.redd.it/npi4r7nr7xn91,What y’all think abt the gentrification of blocks in the city. Y’all think it’s beneficial or nah,,"['y’all', 'think', 'abt', 'the']","['blocks', 'in', 'the', 'city.']"
https://i.redd.it/8w2v07cwlf191.jpg,Gentrification of social justice,,[''],"['social', 'justice']"
https://i.redd.it/6w71uitdq66a1.jpg,I listen to pretty much all of Abel slowed and reverb which is gentrification of chopped and screwed BUT why is the beginning of the song demon slayer??,,"['and', 'reverb', 'which', 'is']","['chopped', 'and', 'screwed', 'BUT']"
https://www.reddit.com/r/kpopnoir/comments/vg1r3m/anybody_else_bothered_by_the_gentrification_of/,Anybody else bothered by the Gentrification of Juneteenth?,"Basically, they're trying to erase the original Juneteenth flag (Red, Black & Green) with the combined flag holiday of Red, White & Blue (Fourth of July and Juneteenth). We already have the shortest month to celebrate being black and now they just completely disrespected us by doing this... Chile I'm ti'ed.

&#x200B;

E2A: I see a few people pulling up the combined flag that is the erasure of the actual Juneteenth flag. That red, white and blue flag you're seeing for Juneteenth is the Juneteenth & Fourth of July Flag! 

"" A Juneteenth flag was created in 1997 that included the colors red, white and blue. **Many Black people celebrate Juneteenth with a flag that is red, black and green** ""","['else', 'bothered', 'by', 'the']",['Juneteenth?']
https://triad-city-beat.com/thanks-i-hate-it-painting-over-community-murals/,Painting over murals and the gentrification of the Southside,,"['over', 'murals', 'and', 'the']","['the', 'Southside']"
https://www.reddit.com/r/explainlikeimfive/comments/wjfeo5/eli5_how_does_gentrification_of_an_area_start/,Eli5: How does gentrification of an area start?,"Do leaders sit in a meeting and decide their next target, or is it more organic?","['Eli5:', 'How', 'does']","['an', 'area', 'start?']"
https://www.reddit.com/r/auckland/comments/yq9ibq/extreme_gentrification_of_ayr_road_pakuranga/,Extreme Gentrification of Ayr Road (Pakuranga),"I just came across these aerial images from a property listing, and it’s truly quite remarkable how much Ayr Road (in Pakuranga) is being developed lately.   


Does anyone live in an area like this? It seems like all the original houses are disappearing and being replaced with tiny little toy houses lol 

&#x200B;

https://preview.redd.it/vzbo7n141vy91.jpg?width=2224&format=pjpg&auto=webp&s=83ba5848dec034173c2f0d8de5271b08ba923603

https://preview.redd.it/afqpqn141vy91.jpg?width=2214&format=pjpg&auto=webp&s=94f6e39895d16fe3afc773da0a0096442dae0d69

https://preview.redd.it/aopsen141vy91.jpg?width=2227&format=pjpg&auto=webp&s=f6fce46f529e629d84e9f3ce66acf4ea0dc00230

https://preview.redd.it/v214aq141vy91.jpg?width=2222&format=pjpg&auto=webp&s=19b470c283ea64b1966fdf2a530bd89e6a715579",['Extreme'],"['Ayr', 'Road', '(Pakuranga)']"
https://www.indystar.com/story/news/real-estate/2022/03/08/good-bones-house-flipping-and-gentrification-fountain-square-indianapolis-indiana/6972501001/,'It's gone.' HGTV show 'Good Bones' accused of gentrification of Fountain Square - The Indianapolis Star,,"['Good', 'Bones', 'accused', 'of']","['Fountain', 'Square', '-', 'The']"
https://www.reddit.com/r/WestVirginia/comments/sly97p/gentrification_of_west_virginia/,Gentrification of West Virginia,"In the examination of increasing cost of living across the country in my series Affordable America it is beginning to become apparent to me that we are on the verge of a national crisis. Homes are being purchase by non-owner occupants at a greater clip than ever before. This is coupled with the disruption of work that has occurred during the pandemic seems to be escalating migratory patterns. Just like people in my city are getting priced out of their preferred neighborhoods pushing them to buy in adjacent lower income neighborhoods. 

All of this said I feel it is inevitable that this is going to happen to West Virginia. 

I would like to start a conversation from West Virginians about how this is already affecting them and also what people thinking about moving to WV in the next decade could be mindful of in order to not be part of the problem. 

Thanks in advance for y'all's input.",[''],"['West', 'Virginia']"
https://www.reddit.com/r/ourtownreno/comments/yp02s5/the_never_ending_gentrification_of_reno/,The Never Ending Gentrification of Reno,"In Reno where motels get crushed, people without sufficient means get displaced and old homes are moved along to disjointed relocated futures to be replaced by fenced off empty lots, new parking lots and unaffordable bland apartments with luxury in their names and people who get titles like chief experience officer. Sidewalks get fixed after all this happens which is the very definition of gentrification.  

https://preview.redd.it/liew8kobely91.jpg?width=3024&format=pjpg&auto=webp&s=0b58c23a92aeb78d17e8c0806e6874a622d686ad","['The', 'Never', 'Ending']",['Reno']
https://culturedigitally.org/2019/03/the-gentrification-of-the-internet/,The gentrification of the internet,,['The'],"['the', 'internet']"
https://www.youtube.com/watch?v=Mfn07pWr35w,"Police presence at a protest against the gentrification of Exarcheia provokes a riot (Athens, Greece)",,"['a', 'protest', 'against', 'the']","['Exarcheia', 'provokes', 'a', 'riot']"
https://www.reddit.com/r/TooAfraidToAsk/comments/uivhva/why_is_gentrification_of_neighborhoods_considered/,Why is gentrification of neighborhoods considered wrong or immoral? What's wrong with cleaning up a bad are and making it a more pleasant place to live and work?,,"['Why', 'is']","['neighborhoods', 'considered', 'wrong', 'or']"
https://www.reddit.com/r/SurreyBC/comments/t65hfg/gentrification_of_surrey/,Gentrification of Surrey,"Surrey was pretty much for the longest time, one of the cheapest areas to live in the Lower Mainland. It appears that time is nearing to an end, what will it do to the city, and its people, when areas start getting gentrified.

I can see 108th eventually getting gentrified when all of the towers get built out. Anyone lamenting the end of affordabilitity and mom/pop shops or we all looking forward to the city changing.",[''],['Surrey']
https://i.imgur.com/Jh94CAu.jpg,Does anyone know where the meth vendors went after the gentrification of Skyline Park?,,"['vendors', 'went', 'after', 'the']","['Skyline', 'Park?']"
https://www.reddit.com/r/fantasywriters/comments/y71jey/renaissance_style_fantasy_how_would_you_describe/,Renaissance style fantasy. How would you describe the gentrification of a neighborhood?,"Hello!

I'm writing a story set in a fantasy world in which technology, science and philosophy is similar to Renaissance Italy. Magic competes with technology. My main characters need to gain political support from the city council, dominated by 2 or 3 ""historical"" factions and a rising corporation. This support is needed to officially investigate against an ally that may be ready to betray them, stipulating a treaty with a common enemy to invade and conquer this rich city and its possessions. People in the city council have their own reasons to want to shut down the investigation not to bother their commerce, or to want a war with the former ally to boost their power. 

About the rising corporation, at first i thought about the wool merchants (Medici in Florence were part of the wool corporation), but i still can change it. It can be whatever speculative bubble that works in my story.

So, i would like to describe the ""wool corporation neighborhood"" as an area inhabited by new riches who kick working class out. How can I describe it? What kind of improvements and entertainment would this new upper middle class want?","['would', 'you', 'describe', 'the']","['a', 'neighborhood?']"
https://www.reddit.com/r/boston/comments/rbzwop/disappointed_by_the_gentrification_of_newbury/,Disappointed by the gentrification of Newbury Street.,"Once upon a time Newbury St has so much local character. Just wandering down the street you'd be greeted by such sights as the Giant Bronze Teddy Bear and the Ghost Bride. Street musicians, vendors and painters that you'd see out there every day working their mojo. I mean, where else could you go into a store filled with crinkly leaves and stare at dusty religious and dragon statues, find a hundred things to cover your penis with, or 1000 things shaped like a unicorn? Below street record shops and the Concrete Stoop where everyone ate ice cream. Cars with modified exhaust and nuclear-powered subwoofers blocking traffic for no apparent reason.  


...well I guess we still have that last one","['Disappointed', 'by', 'the']","['Newbury', 'Street.']"
https://kolektiva.social/@dromografos/109289679510234114,dromografos.com: Demonstration last night in #Athens against gentrification of #exarxeia against the #cops. #antireport,,"['night', 'in', '#Athens', 'against']","['#exarxeia', 'against', 'the', '#cops.']"
https://www.reddit.com/r/ABoringDystopia/comments/vftotr/a_mandatory_topic_in_my_geography_gcse_is/,A mandatory topic in my Geography GCSE is celebrating the aggressive gentrification of East Village in Stratford,"For those who don’t know, that’s where today the 2012 Olympics Games were hosted. They used the money to “relocate” all the previous inhabitants, knock down their houses, and replace them with shiny £1700/month 2-bedroom apartments for finance bro’s. 

We had to interview them (the rich inhabitants, not the people who got relocated or the poorer blue-collar workers working there) on the area, and they loved it. The tiny, incredibly overpriced modern apartments which were the only housing, the overpriced smoothie-and-avocado-toast cafes which were the only cafes, the “urban green spaces” with their anti-homeless benches. The only thing that didn’t consistently get 5/5 ratings was the crime rate. When we asked them to elaborate on “crime rate” and they went on about how there’s lots of young people smoking “the cannabis” in some of their precious urban green spaces","['is', 'celebrating', 'the', 'aggressive']","['East', 'Village', 'in', 'Stratford']"
https://freddiedeboer.substack.com/p/the-gentrification-of-disability?s=r,The Gentrification of Disability,,['The'],['Disability']
https://www.reddit.com/r/london/comments/nu6d97/the_gentrification_of_london_beyond_sky_pools_and/,The gentrification of London: Beyond sky pools and cereal cafes,"Don't think anyone posted about the report on gentrification that came out last week, so thought the latest edition of our newsletter might be of interest to some people: [here it is](https://londoninbits.substack.com/p/the-gentrification-of-london-beyond?r=jbz66&utm_campaign=post&utm_medium=web&utm_source=copy).

Edit: Forgot to mention we're hopefully interviewing one of the authors of the report later this week, so any questions, just let us know.",['The'],"['London:', 'Beyond', 'sky', 'pools']"
https://youtu.be/z5Pr4fPQbMs,A Brief History and Gentrification of: Chuck’s Drink,,"['A', 'Brief', 'History', 'and']","[':', 'Chuck’s', 'Drink']"
https://www.reddit.com/r/austincirclejerk/comments/sukdkd/i_drove_past_a_business_i_havent_shopped_at_or/,"I drove past a business I haven't shopped at or patronized in years, and I was shocked and horrified that it is now gone! I hate this gentrification of Austin!",What happened to all these businesses?  It must be all these out of towners that did this to us!  They are the enemy of native Austinites!,"['gone!', 'I', 'hate', 'this']",['Austin!']
https://i.imgur.com/VT7WM6S.jpg,The gentrification of Capitol Hill continues,,['The'],"['Capitol', 'Hill', 'continues']"
https://www.reddit.com/r/rva/comments/tax5dk/whats_your_throughts_on_the_gentrification_of/,What’s your throughts on the gentrification of Richmond neighborhoods?,"I personally hate it crime has shifted into my once safe and quiet part of my neighborhood, in the past year I’ve been shot at twice, I hear gunshots literally every night sometimes during the day and someone has tried breaking into my house 3 times that I know of","['your', 'throughts', 'on', 'the']","['Richmond', 'neighborhoods?']"
https://www.reddit.com/r/britishproblems/comments/vfgld9/geography_fieldwork_thats_just_cheering_on_the/,"“Geography fieldwork” that’s just cheering on the aggressive gentrification of East Village, Stratford","For those who don’t know, that’s where today the 2012 Olympics Games were hosted. They used the money to “relocate” all the previous inhabitants, knock down their houses, and replace them with shiny £1700/month 2-bedroom apartments for finance bro’s. 

We had to interview them (the rich inhabitants, not the people who got relocated or the poorer blue-collar workers working there) on the area, and they loved it. The tiny, incredibly overpriced modern apartments which were the only housing, the overpriced smoothie-and-avocado-toast cafes which were the only cafes, the “urban green spaces” with their anti-homeless benches. The only thing that didn’t consistently get 5/5 ratings was the crime rate. When we asked them to elaborate on “crime rate” and they went on about how there’s lots of young people smoking “the cannabis” in some of their precious urban green spaces","['cheering', 'on', 'the', 'aggressive']","['East', 'Village', 'Stratford']"
https://i.redd.it/8w2v07cwlf191.jpg,Gentrification of social justice,,[''],"['social', 'justice']"
https://i.redd.it/qm7jwhn403271.jpg,"At front of St. Marks Cinema, protestors against gentrification of the East Village in 1984. Photo: David Vega",,"['Marks', 'Cinema', 'protestors', 'against']","['the', 'East', 'Village', 'in']"
https://www.reddit.com/r/houston/comments/m534w1/gentrification_of_acres_homes_begins/,Gentrification of Acres Homes begins,"Now known as Highland Heights

https://preview.redd.it/dcr98dw1x1n61.jpg?width=828&format=pjpg&auto=webp&s=6101b7fd182b705c3aed64a0e462902e024942bb",[''],"['Acres', 'Homes', 'begins']"
https://www.reddit.com/r/Binghamton/comments/sdii06/land_and_lawsuits_anzaroots_botched_bet_on/,Land and Lawsuits - Anzaroot's Botched Bet on Baseball - The gentrification of Henry St.,"Don’t read too far into the title. Trying to have a little fun. Incoming lower effort post. 

Here are a few things I observed that tie into previous conversations about housing, gentrification, and slumlords that I consider interesting.

Isaac Anzaroot (MEJA Group LLC) recently purchased 6 properties from Faisal Afify (Pharaoh Group LLC) in August 2021. In previous observations, Anzaroot has purchased a number of properties from Afify over the last few years. 3 of these properties from the latest purchase are located on Henry St., accounting for 83 units. All of these units are currently empty. 

The Henry St properties are already being auctioned off beginning January 31st. The auction listing is titled [University/Stadium District Housing](https://www.loopnet.com/Listing/University-Stadium-District-Housing/22723425/). I interpret this as the beginning phase in the gentrification of the Henry St. & Pine St. neighborhoods. I think that is a common concern from residents in that neighborhood ever since the City announced plans for the [Stadium District Master Plan](https://drive.google.com/file/d/1e8c6OYSJoBOmaDPqe-tjmRsqZWVrOecY/view?usp=sharing). It’s interesting to see the initial benefactors of such proposals. Additionally, witnessing the early movements is concerning/interesting! 

[ Stadium District Master Plan](https://preview.redd.it/glc9d202y3e81.png?width=725&format=png&auto=webp&s=5586230c81136fdaf0dc85913303144d7bc9c60a)

It gets slightly more interesting when we see that Anzaroot filed a lawsuit on 11/5/21 against Afify for $3,000,000 in damages.

>“The nature of this action is Breach of Contract, Fraud, Tortious Interference, Slander, Deceptive Business Practices, Compel the Determination of a Claim to Real Property, and for Specific Performance.

So, someone got burned, or is claiming to have been burned. Other than that I have no idea what is going on there. 

&#x200B;

https://preview.redd.it/45yfatztz3e81.png?width=664&format=png&auto=webp&s=ffdb7bea4e94e8b619f5b3b49df1e40cda93bba4

https://preview.redd.it/ujbmgzsb04e81.png?width=727&format=png&auto=webp&s=2a3c5905a0af11449b0bd52acd16a4d5439fd1be","['on', 'Baseball', '-', 'The']","['Henry', 'St.']"
https://www.reddit.com/r/StandUpWorkshop/comments/t8e9lz/the_gentrification_of_comedy/,the gentrification of comedy,"comedy is slowly being gentrified right under our noses, i can't even say bitch anymore because that means im a misogynist. what the fuck is that? do i look like a give massages?!   ...im not even asian.",['the'],['comedy']
https://i.redd.it/wspm69j55wq71.png,"Conservative Christian Gentrification of the Rainbow Pride Flag has begun, only two more causes to go and they'll be flying their ""Conservative Pride Flag""",,"['Conservative', 'Christian']","['the', 'Rainbow', 'Pride', 'Flag']"
https://www.reddit.com/gallery/pl5uub,Gentrification of Woodlawn (62-63rd/Greenwood),,[''],"['Woodlawn', '(62-63rd/Greenwood)']"