,URL,TITLE,TEXT,LEFT CONTEXT,RIGHT CONTEXT,CONTEXT,AUTHOR USERNAME,TIME CREATED
0,https://i.redd.it/m54ek349194b1.png,Added a swimming pool and countered those dragons with some fighter jets. Let the gentrification of Faram commence!,,"['fighter', 'jets.', 'Let', 'the']","['Faram', 'commence!']",gentrification of Faram commence!,SashOfTopatoes,2023-06-06 00:45:15
1,https://www.nber.org/papers/w31480#fromrss,"Household Mobility, Networks, and Gentrification of Minority Neighborhoods in the US -- by Fernando V. Ferreira, Jeanna H. Kenney, Benjamin Smith",,"['Household', 'Mobility', 'Networks', 'and']","['Minority', 'Neighborhoods', 'in', 'the']",gentrification of Minority Neighborhoods in the,ocamlmycaml,2023-07-24 09:36:00
2,https://www.reddit.com/r/AskNYC/comments/13tmstl/besides_rent_and_col_what_are_the_worst_parts_of/,Besides rent and COL what are the worst parts of recent gentrification of the city in your opinion,"As someone who likes music, anime and geek culture. The scene here feels like there's less connection and passion in it, a lot more gimmicky and like it solely exists to sell you something.","['worst', 'parts', 'of', 'recent']","['the', 'city', 'in', 'your']",gentrification of the city in your,NeroTanya2004,2023-05-28 06:00:45
3,https://i.redd.it/sxla2wy6k7oa1.jpg,Here goes the gentrification of the term code switching by none other than amanda bucci,,"['Here', 'goes', 'the']","['the', 'term', 'code', 'switching']",gentrification of the term code switching,Careless_Pea_2068,2023-03-17 02:41:05
4,https://i.redd.it/7zaaujn6phoa1.jpg,I fell down the rabbit hole of “van life families” - it’s the lack of privacy and gentrification of homelessness for me…,,"['lack', 'of', 'privacy', 'and']","['homelessness', 'for', 'me…']",gentrification of homelessness for me…,peach_bee,2023-03-18 12:46:52
5,https://7tv.app/emotes/6375784658ccb5a6d32c0d28,When will you make a public statement on the blatant gentrification of our community?,,"['statement', 'on', 'the', 'blatant']","['our', 'community?']",gentrification of our community?,bulliten,2023-03-13 07:18:42
6,https://i.redd.it/kn14ho12hp3b1.jpg,The gentrification of Tatooine,,['The'],['Tatooine'],gentrification of Tatooine,chickenswhobeateggs,2023-06-03 06:57:35
7,https://i.redd.it/n4xphvypl77b1.png,"*sigh* once again stealing our memes not epic, the gentrification of robot juice is here folks :/",,"['memes', 'not', 'epic', 'the']","['robot', 'juice', 'is', 'here']",gentrification of robot juice is here,James-Sonic,2023-06-20 23:08:34
8,https://www.reddit.com/r/jambands/comments/13sldjy/gentrification_of_planet_earth/,Gentrification of Planet Earth!!!,"Greetings earthlings!

I know it's kinda frowned upon to self-promote on reddit, and I really haven't before but I've poured the last 5 years of my heart, passion, and creativity into this album and while the press hasn't really come through for us on this release, I'm confident that y'all beautiful people can help us get some streams.

For those new to our sound, we've been compared to the likes of Turkuaz and Thumpasaurus and have been described as Zappa meets OutKast. The new album is campy horror allegory with Lovecraftian imagery and ferocious rap-rock tones. If you want to dip your toe in I'd suggest the tracks: Multi-Dimensional Space Kraken, Spooky Food, Gentrification of Planet Earth, or Abortable Housing.

Thanks for listening and if you're in Austin we're playing our release/farewell show at Parish tonight at 8pm.

Best,

Squiggly Finesse of Bourgeois Mystics",[''],"['Planet', 'Earth!!!']",gentrification of Planet Earth!!!,BourgeoisMystics,2023-05-27 00:24:26
9,https://www.bathecho.co.uk/news/politics/concern-raised-people-without-id-vote-101198/?mc_cid=218d596e6f&mc_eid=cc667ae9f4,The gentrification of democracy,,['The'],['democracy'],gentrification of democracy,Aardvark51,2023-02-28 15:28:53
10,https://www.latimes.com/opinion/letters-to-the-editor/story/2023-06-02/congestion-pricing-gentrification-of-the-roads-or-the-obvious-traffic-fix,"[Op-Ed] - Letters to the Editor: Is congestion pricing 'gentrification of the roads,' or the obvious traffic fix? | LA Times",,"['Is', 'congestion', 'pricing', '']","['the', 'roads', 'or', 'the']",gentrification of the roads or the,AutoNewspaperAdmin,2023-06-02 16:06:36
11,https://www.latimes.com/opinion/letters-to-the-editor/story/2023-06-02/congestion-pricing-gentrification-of-the-roads-or-the-obvious-traffic-fix,"[Op-Ed] - Letters to the Editor: Is congestion pricing 'gentrification of the roads,' or the obvious traffic fix?",,"['Is', 'congestion', 'pricing', '']","['the', 'roads', 'or', 'the']",gentrification of the roads or the,AutoNewsAdmin,2023-06-02 15:48:40
12,https://academictimes.com/gentrification-may-emerge-because-rich-people-work-long-hours/,"Gentrification of inner city areas may be partly driven by the increasingly long hours of higher-income workers who move to city centers to cut commutes and demand less crime and more restaurants. The study found that by 1990, working longer hours became more common among the ""high-skilled"".",,[''],"['inner', 'city', 'areas', 'may']",gentrification of inner city areas may,mvea,2021-05-16 17:10:52
13,https://www.reddit.com/r/ukdrill/comments/z2og6z/do_you_think_regeneration_and_gentrification_of/,"Do you think regeneration and gentrification of the most deprived and crime-ridden areas in London e.g. Peckham, Brixton and Brick Lane area will see the decrease of gangs in the next 20 years?","

[View Poll](https://www.reddit.com/poll/z2og6z)","['you', 'think', 'regeneration', 'and']","['the', 'most', 'deprived', 'and']",gentrification of the most deprived and,NoDealsMrBond,2022-11-23 18:27:05
14,https://www.reddit.com/r/boston/comments/rbvxz8/disappointed_by_the_gentrification_of_kenmore/,Disappointed by the gentrification of kenmore square.,"Once upon a time kenmore square had so much local character, ihop, bertuccis, mcdonalds , GAP, a single shop that was a blockbuster/dunks/baskin robbins. You could even find a burger king and taco bell down the road in BU. Now we dont have anything. There is barely anyone yelling at me or asking for money. There is only one abandoned building in the area.  This is so disappointing and how a city loses character.","['Disappointed', 'by', 'the']","['kenmore', 'square.']",gentrification of kenmore square.,anurodhp,2021-12-08 22:40:59
15,https://www.reddit.com/r/RealEstate/comments/11dtdmz/will_the_increased_pricing_in_houses_push/,Will the increased pricing in houses push gentrification of neighborhoods to move quicker?,I’m interested to hear what people think about this. I live in a LCOL area and I’ve watched several neighborhoods in my city clean themselves up over the past 20 yrs. Now with high earners working from home scooping up property here the dynamics of some neighborhoods will certainly shift. Thoughts?,"['pricing', 'in', 'houses', 'push']","['neighborhoods', 'to', 'move', 'quicker?']",gentrification of neighborhoods to move quicker?,SpatialThoughts,2023-02-28 07:11:48
16,https://www.reddit.com/r/Urbanism/comments/11rmre0/how_does_the_integration_of_bluegreen/,How does the integration of Blue-Green Infrastructure in cities lead to the displacement or gentrification of communities?,"I'm currently working on preparing a development plan of an Indian city as a part of my academic project. Our broad approach was to increase the per capita public space by creating more parks and green buffers considering that the entire city lacks the minimum requirement of 9 sq.m. 

However I read this paper which says that there are cases where by integrating more green spaces in localised areas, the market price of the area increases which polarizes the affordability and therefore displaces communities. I'd like to gain more perspective on it.","['to', 'the', 'displacement', 'or']",['communities?'],gentrification of communities?,king_kortobbo,2023-03-15 10:37:08
17,https://www.youtube.com/watch?v=Mfn07pWr35w,"Police presence at a protest against the gentrification of Exarcheia provokes a riot (Athens, Greece)",,"['a', 'protest', 'against', 'the']","['Exarcheia', 'provokes', 'a', 'riot']",gentrification of Exarcheia provokes a riot,petrosmisirlis,2022-06-29 00:11:35
18,https://www.reddit.com/r/Gent/comments/yubh3z/opinionscomplaints_on_gentrification_of_gent/,Opinions/complaints on gentrification of Gent,"Working class neighborhoods like the Dampoort, Brugse Poort, Ledeberg, Sleepstraat etc. are all gentrifying and tbh it’s kind of weird to me. Nobody but the (mostly flemish) upper class is benefiting from this while the rest of us are just trying to survive and pay our rent. 

The true Gentenaars don’t need a yoga studio or a expensive coffeeshop or a ultraliberal bookshop… especially not in the historically working class neighbourhoods that i’ve mentioned above. 

It’s also highly unfair for the working class people because we barely can afford living in Gent but the hipsters and gentrifiers can settle down anywhere from Sint Pieters to Muide… and the city is doing NOTHING to counter this inequality. While in other cities like Brussels and Antwerp many working class and POC people live in the centre, here in Gent we are mostly forced to live on the outer ring.","['Opinions/complaints', 'on']",['Gent'],gentrification of Gent,ultramegagigagangsta,2022-11-14 01:03:20
19,https://i.imgur.com/LRGv52n.jpg,The Gentrification of Hove...,,['The'],['Hove...'],gentrification of Hove...,SAGGYCUNT,2022-09-30 13:52:56
20,https://i.redd.it/jxaj8ux20ay91.jpg,It’s going to take a little longer for the gentrification of Willagee to be complete.,,"['little', 'longer', 'for', 'the']","['Willagee', 'to', 'be', 'complete.']",gentrification of Willagee to be complete.,xRicharizard,2022-11-06 12:06:15
21,https://i.redd.it/0fmrv8uvc7ma1.png,"Once again we are seeing the gentrification of Robot Juice taking place, the seed is being taken away and spread",,"['we', 'are', 'seeing', 'the']","['Robot', 'Juice', 'taking', 'place']",gentrification of Robot Juice taking place,Banana-Caesar,2023-03-07 04:52:44
22,https://www.reddit.com/r/boston/comments/rchbln/activists_decry_gentrification_of_seaport/,Activists decry gentrification of seaport,"BOSTON — amidst a dusting of light snow, parking lot and warehouse enthusiasts have gathered in the seaport to protest the gentrification of the neighborhood.

Karen, a vegan from Somerville is appalled by the  environmental damage. “There was a whole habitat of plants and animals living in the old parking lots” she said, “and now it’s gone”.

Others were here for different reasons. “This is matter of equity”, says Kim, an activist from the south end.  Asked to elaborate she emphasized the loss of parking lots raised equity issues. 

Jim, unemployed from Wellesley spoke about the warehouses. “There was a whole community that gathered here. People see dilapidated buildings but it was more than that”. A child of the 80s, he continued “the condo developers can’t be stopped with a montage. This is real life”.

Among these protesters an unlikely ally. Luis a father of four and construction worker from Revere. “I just went to get coffee” he says, “can I go back to work?” , highlighting the displacement felt by the POC community.","['Activists', 'decry']",['seaport'],gentrification of seaport,anurodhp,2021-12-09 18:38:26
23,https://i.redd.it/hskppaf277ia1.png,"The gentrification of Robot Juice is happening, they're stealing our memes",,['The'],"['Robot', 'Juice', 'is', 'happening']",gentrification of Robot Juice is happening,OrangeFlavoredPizza,2023-02-15 00:03:09
24,https://i.redd.it/7s5sjzvw50x91.jpg,The gentrification of a local fest :(,,['The'],"['a', 'local', 'fest', ':(']",gentrification of a local fest :(,GraffitI391,2022-10-31 01:56:57
25,https://v.redd.it/9dn5w7ze1z281,The gentrification of homelessness,,['The'],['homelessness'],gentrification of homelessness,stonedandhydrated,2021-12-01 23:37:51
26,https://v.redd.it/gij70n1r984a1,The left is somewhere between gross car glorification and gentrification of r/urbancarliving,,"['gross', 'car', 'glorification', 'and']",['r/urbancarliving'],gentrification of r/urbancarliving,im-just-trying-ok,2022-12-06 20:51:32
27,https://v.redd.it/npi4r7nr7xn91,What y’all think abt the gentrification of blocks in the city. Y’all think it’s beneficial or nah,,"['y’all', 'think', 'abt', 'the']","['blocks', 'in', 'the', 'city.']",gentrification of blocks in the city.,Mundane-Prune-8696,2022-09-15 06:25:09
28,https://i.redd.it/8w2v07cwlf191.jpg,Gentrification of social justice,,[''],"['social', 'justice']",gentrification of social justice,EgyptianNational,2022-05-24 20:39:06
29,https://www.reddit.com/r/explainlikeimfive/comments/wjfeo5/eli5_how_does_gentrification_of_an_area_start/,Eli5: How does gentrification of an area start?,"Do leaders sit in a meeting and decide their next target, or is it more organic?","['Eli5:', 'How', 'does']","['an', 'area', 'start?']",gentrification of an area start?,QuakerOats91_,2022-08-08 23:24:48
30,https://i.redd.it/6w71uitdq66a1.jpg,I listen to pretty much all of Abel slowed and reverb which is gentrification of chopped and screwed BUT why is the beginning of the song demon slayer??,,"['and', 'reverb', 'which', 'is']","['chopped', 'and', 'screwed', 'BUT']",gentrification of chopped and screwed BUT,Ill_Top1906,2022-12-16 04:39:34
31,https://www.reddit.com/r/auckland/comments/yq9ibq/extreme_gentrification_of_ayr_road_pakuranga/,Extreme Gentrification of Ayr Road (Pakuranga),"I just came across these aerial images from a property listing, and it’s truly quite remarkable how much Ayr Road (in Pakuranga) is being developed lately.   


Does anyone live in an area like this? It seems like all the original houses are disappearing and being replaced with tiny little toy houses lol 

&#x200B;

https://preview.redd.it/vzbo7n141vy91.jpg?width=2224&format=pjpg&auto=webp&s=83ba5848dec034173c2f0d8de5271b08ba923603

https://preview.redd.it/afqpqn141vy91.jpg?width=2214&format=pjpg&auto=webp&s=94f6e39895d16fe3afc773da0a0096442dae0d69

https://preview.redd.it/aopsen141vy91.jpg?width=2227&format=pjpg&auto=webp&s=f6fce46f529e629d84e9f3ce66acf4ea0dc00230

https://preview.redd.it/v214aq141vy91.jpg?width=2222&format=pjpg&auto=webp&s=19b470c283ea64b1966fdf2a530bd89e6a715579",['Extreme'],"['Ayr', 'Road', '(Pakuranga)']",gentrification of Ayr Road (Pakuranga),Realistic-Handle-616,2022-11-09 10:50:22
32,https://culturedigitally.org/2019/03/the-gentrification-of-the-internet/,The gentrification of the internet,,['The'],"['the', 'internet']",gentrification of the internet,john133435,2022-01-13 01:43:26
33,https://www.reddit.com/r/TooAfraidToAsk/comments/uivhva/why_is_gentrification_of_neighborhoods_considered/,Why is gentrification of neighborhoods considered wrong or immoral? What's wrong with cleaning up a bad are and making it a more pleasant place to live and work?,,"['Why', 'is']","['neighborhoods', 'considered', 'wrong', 'or']",gentrification of neighborhoods considered wrong or,Common_Coyote_3,2022-05-05 17:07:51
34,https://www.youtube.com/watch?v=Mfn07pWr35w,"Police presence at a protest against the gentrification of Exarcheia provokes a riot (Athens, Greece)",,"['a', 'protest', 'against', 'the']","['Exarcheia', 'provokes', 'a', 'riot']",gentrification of Exarcheia provokes a riot,petrosmisirlis,2022-06-29 01:22:45
35,https://www.reddit.com/r/ourtownreno/comments/yp02s5/the_never_ending_gentrification_of_reno/,The Never Ending Gentrification of Reno,"In Reno where motels get crushed, people without sufficient means get displaced and old homes are moved along to disjointed relocated futures to be replaced by fenced off empty lots, new parking lots and unaffordable bland apartments with luxury in their names and people who get titles like chief experience officer. Sidewalks get fixed after all this happens which is the very definition of gentrification.  

https://preview.redd.it/liew8kobely91.jpg?width=3024&format=pjpg&auto=webp&s=0b58c23a92aeb78d17e8c0806e6874a622d686ad","['The', 'Never', 'Ending']",['Reno'],gentrification of Reno,thebrushup,2022-11-08 02:25:48
36,https://www.youtube.com/watch?v=Mfn07pWr35w,"Police presence at a protest against the gentrification of Exarcheia provokes a riot (Athens, Greece)",,"['a', 'protest', 'against', 'the']","['Exarcheia', 'provokes', 'a', 'riot']",gentrification of Exarcheia provokes a riot,petrosmisirlis,2022-06-29 00:15:44
37,https://i.imgur.com/Jh94CAu.jpg,Does anyone know where the meth vendors went after the gentrification of Skyline Park?,,"['vendors', 'went', 'after', 'the']","['Skyline', 'Park?']",gentrification of Skyline Park?,Overall_Ad_6540,2022-05-28 21:38:37
38,https://www.reddit.com/r/fantasywriters/comments/y71jey/renaissance_style_fantasy_how_would_you_describe/,Renaissance style fantasy. How would you describe the gentrification of a neighborhood?,"Hello!

I'm writing a story set in a fantasy world in which technology, science and philosophy is similar to Renaissance Italy. Magic competes with technology. My main characters need to gain political support from the city council, dominated by 2 or 3 ""historical"" factions and a rising corporation. This support is needed to officially investigate against an ally that may be ready to betray them, stipulating a treaty with a common enemy to invade and conquer this rich city and its possessions. People in the city council have their own reasons to want to shut down the investigation not to bother their commerce, or to want a war with the former ally to boost their power. 

About the rising corporation, at first i thought about the wool merchants (Medici in Florence were part of the wool corporation), but i still can change it. It can be whatever speculative bubble that works in my story.

So, i would like to describe the ""wool corporation neighborhood"" as an area inhabited by new riches who kick working class out. How can I describe it? What kind of improvements and entertainment would this new upper middle class want?","['would', 'you', 'describe', 'the']","['a', 'neighborhood?']",gentrification of a neighborhood?,Liscetta,2022-10-18 14:27:53
39,https://freddiedeboer.substack.com/p/the-gentrification-of-disability?s=r,The Gentrification of Disability,,['The'],['Disability'],gentrification of Disability,ugathanki,2022-05-25 20:02:38
40,https://www.youtube.com/watch?v=Mfn07pWr35w,"Police presence at a protest against the gentrification of Exarcheia provokes a riot (Athens, Greece)",,"['a', 'protest', 'against', 'the']","['Exarcheia', 'provokes', 'a', 'riot']",gentrification of Exarcheia provokes a riot,petrosmisirlis,2022-06-29 00:13:05
41,https://i.redd.it/8w2v07cwlf191.jpg,Gentrification of social justice,,[''],"['social', 'justice']",gentrification of social justice,EgyptianNational,2022-05-24 19:40:58
42,https://www.youtube.com/watch?v=Mfn07pWr35w,"Police presence at a protest against the gentrification of Exarcheia provokes a riot (Athens, Greece)",,"['a', 'protest', 'against', 'the']","['Exarcheia', 'provokes', 'a', 'riot']",gentrification of Exarcheia provokes a riot,petrosmisirlis,2022-06-29 00:16:50
43,https://www.youtube.com/watch?v=Mfn07pWr35w,"Police presence at a protest against the gentrification of Exarcheia provokes a riot (Athens, Greece)",,"['a', 'protest', 'against', 'the']","['Exarcheia', 'provokes', 'a', 'riot']",gentrification of Exarcheia provokes a riot,petrosmisirlis,2022-06-29 00:14:31
44,https://www.reddit.com/r/StandUpWorkshop/comments/t8e9lz/the_gentrification_of_comedy/,the gentrification of comedy,"comedy is slowly being gentrified right under our noses, i can't even say bitch anymore because that means im a misogynist. what the fuck is that? do i look like a give massages?!   ...im not even asian.",['the'],['comedy'],gentrification of comedy,anon24848,2022-03-07 07:25:24
45,https://www.youtube.com/watch?v=Mfn07pWr35w,"Police presence at a protest against the gentrification of Exarcheia provokes a riot (Athens, Greece)",,"['a', 'protest', 'against', 'the']","['Exarcheia', 'provokes', 'a', 'riot']",gentrification of Exarcheia provokes a riot,petrosmisirlis,2022-06-29 00:09:32
46,https://www.youtube.com/watch?v=Mfn07pWr35w,"Police presence at a protest against the gentrification of Exarcheia provokes a riot (Athens, Greece)",,"['a', 'protest', 'against', 'the']","['Exarcheia', 'provokes', 'a', 'riot']",gentrification of Exarcheia provokes a riot,petrosmisirlis,2022-06-29 00:08:49
47,https://www.youtube.com/watch?v=Mfn07pWr35w,Police presence at a protest against the gentrification of Exarcheia provokes a riot (Athens Greece),,"['a', 'protest', 'against', 'the']","['Exarcheia', 'provokes', 'a', 'riot']",gentrification of Exarcheia provokes a riot,petrosmisirlis,2022-06-29 00:12:19
48,https://www.youtube.com/watch?v=Mfn07pWr35w,"Police presence at a protest against the gentrification of Exarcheia provokes a riot (Athens, Greece)",,"['a', 'protest', 'against', 'the']","['Exarcheia', 'provokes', 'a', 'riot']",gentrification of Exarcheia provokes a riot,petrosmisirlis,2022-06-29 00:14:09
49,https://i.redd.it/wspm69j55wq71.png,"Conservative Christian Gentrification of the Rainbow Pride Flag has begun, only two more causes to go and they'll be flying their ""Conservative Pride Flag""",,"['Conservative', 'Christian']","['the', 'Rainbow', 'Pride', 'Flag']",gentrification of the Rainbow Pride Flag,RustyBarbwiredCactus,2021-10-02 01:05:37
50,https://www.youtube.com/watch?v=Mfn07pWr35w,"Police presence at a protest against the gentrification of Exarcheia provokes a riot (Athens, Greece)",,"['a', 'protest', 'against', 'the']","['Exarcheia', 'provokes', 'a', 'riot']",gentrification of Exarcheia provokes a riot,petrosmisirlis,2022-06-29 00:16:25
51,https://www.youtube.com/watch?v=Mfn07pWr35w,"Police presence at a protest against the gentrification of Exarcheia provokes a riot (Athens, Greece)",,"['a', 'protest', 'against', 'the']","['Exarcheia', 'provokes', 'a', 'riot']",gentrification of Exarcheia provokes a riot,petrosmisirlis,2022-06-29 00:13:41
52,https://www.youtube.com/watch?v=Mfn07pWr35w,"Police presence at a protest against the gentrification of Exarcheia provokes a riot (Athens, Greece)",,"['a', 'protest', 'against', 'the']","['Exarcheia', 'provokes', 'a', 'riot']",gentrification of Exarcheia provokes a riot,petrosmisirlis,2022-06-29 00:06:25
53,https://www.youtube.com/watch?v=Mfn07pWr35w,"Police presence at a protest against the gentrification of Exarcheia provokes a riot (Athens, Greece)",,"['a', 'protest', 'against', 'the']","['Exarcheia', 'provokes', 'a', 'riot']",gentrification of Exarcheia provokes a riot,petrosmisirlis,2022-06-29 00:07:00
54,https://www.youtube.com/watch?v=Mfn07pWr35w,"Police presence at a protest against the gentrification of Exarcheia provokes a riot (Athens, Greece)",,"['a', 'protest', 'against', 'the']","['Exarcheia', 'provokes', 'a', 'riot']",gentrification of Exarcheia provokes a riot,petrosmisirlis,2022-06-29 00:11:13
55,https://www.reddit.com/r/unpopularopinion/comments/mp2k0y/people_who_are_in_tech_and_live_in_silicon/,People who are in tech and live in Silicon Valley/Bay Area should bite the economic bullet and stay where they are to prevent further gentrification of other cities,"Let's face it, the chief cause of the skyrocketing cost of living is due to tech companies and their workers moving to different cities and skyrocketing prices higher than what the original inhabitants can afford

Tech workers need to bite the bullet and stay where they are already at to prevent the gentrification of other cities. That or stop willingly buying the most expensive apartments and properties you see.","['are', 'to', 'prevent', 'further']","['other', 'cities']",gentrification of other cities,Tessenreacts,2021-04-12 05:30:52
56,https://www.youtube.com/watch?v=Mfn07pWr35w,"Police presence at a protest against the gentrification of Exarcheia provokes a riot (Athens, Greece)",,"['a', 'protest', 'against', 'the']","['Exarcheia', 'provokes', 'a', 'riot']",gentrification of Exarcheia provokes a riot,petrosmisirlis,2022-06-29 00:10:28
57,https://www.youtube.com/watch?v=Mfn07pWr35w,"Police presence at a protest against the gentrification of Exarcheia provokes a riot (Athens, Greece)",,"['a', 'protest', 'against', 'the']","['Exarcheia', 'provokes', 'a', 'riot']",gentrification of Exarcheia provokes a riot,petrosmisirlis,2022-06-29 00:10:03
58,https://academictimes.com/gentrification-may-emerge-because-rich-people-work-long-hours/,Factor of increased gentrification of inner city areas,,"['Factor', 'of', 'increased']","['inner', 'city', 'areas']",gentrification of inner city areas,catnald,2021-05-17 05:23:06
59,https://www.youtube.com/watch?v=Mfn07pWr35w,"Police presence at a protest against the gentrification of Exarcheia provokes a riot (Athens, Greece)",,"['a', 'protest', 'against', 'the']","['Exarcheia', 'provokes', 'a', 'riot']",gentrification of Exarcheia provokes a riot,petrosmisirlis,2022-06-29 00:15:17
60,https://mixmag.net/feature/the-gentrification-of-jungle/,The gentrification of jungle,,['The'],['jungle'],gentrification of jungle,IAMALWAYSSHOUTING,2022-01-21 17:56:48
