,URL,TITLE,TEXT,LEFT CONTEXT,RIGHT CONTEXT,CONTEXT,AUTHOR USERNAME,TIME CREATED
61,https://www.reddit.com/r/shroomstocks/comments/oa5fcx/microdosing_and_the_gentrification_of_psychedelic/,"Microdosing, And The Gentrification Of Psychedelic Culture. A Conversation With Sociologist Dimitrios Liokaftos","Psychedelic use is no longer a relatively small, counterculture phenomenon. Indeed, by microdosing, tech workers and many career strivers seem to be infusing psychedelics into the brave, new, somewhat middle class and much larger world of social and professional ladder climbing.

Microdosing is defined as the regular use of a psychedelic drug (a/k/a hallucinogen) at amounts so tiny as to be impossible to consciously perceive. This generally translates into 1/10 – 1/20 of a recreational dose. Many enthusiasts swear by microdosing’s positive effect on mood, insight, and creativity. Studies that rely on self-reporting have tended to bolster such anecdotal claims, but other evidence suggests that the effects of microdosing are illusory. For example, in one double-blind study, microdosing improved users’ mood, energy, and creativity — but so did the placebo.

[https://www.forbes.com/sites/rebeccacoffey/2021/06/29/microdosing-and-the-gentrification-of-psychedelic-culture-a-conversation-with-sociologist-dimitrios-liokaftos/](https://www.forbes.com/sites/rebeccacoffey/2021/06/29/microdosing-and-the-gentrification-of-psychedelic-culture-a-conversation-with-sociologist-dimitrios-liokaftos/)","['Microdosing', 'And', 'The']","['Psychedelic', 'Culture.', 'A', 'Conversation']",gentrification of Psychedelic Culture. A Conversation,rugerapatt,2021-06-29 15:49:00
62,https://i.redd.it/3rfphgo9bt671.jpg,"Behold! The unapologetic gentrification of prisons. Just like the real thing, ‘cept without all the misery.",,"['Behold!', 'The', 'unapologetic']","['prisons.', 'Just', 'like', 'the']",gentrification of prisons. Just like the,limegreenbunny,2021-06-22 18:09:21
63,https://i.redd.it/mo10rb4ir8j01.jpg,The Gentrification of this hood is an enigma.,,['The'],"['this', 'hood', 'is', 'an']",gentrification of this hood is an,NAP_ATTAK,2018-03-02 05:34:51
64,https://www.reddit.com/r/sustainability/comments/i0rfle/gentrification_of_sustainability/,Gentrification of sustainability,"Hey guys, i’m not sure if this is the right place for this but I want to hear reddit’s opinions. I’ve recently been reading a lot about how thrifting and sustainability in general have become gentrified, making it a trendy lifestyle for white wealthy people while simultaneously raising prices in thrift stores, etc. making it inaccessible to poorer people who need to thrift. Examples that are frequently given are wealthy people shopping at goodwill or value village and making prices go up, or teens buying XL pants just to take in the waste later (taking sizes away from those who need the bigger size). 

Personally i’m torn on this issue, because i’m a huge advocate for thrifting and sustainability, and I think everyone should make an effort to switch over if possible. But, I also see their points and realize it’s a valid issue. Maybe there’s possibile compromising solutions, I just haven’t reached one yet. thoughts?",[''],['sustainability'],gentrification of sustainability,Flashy_Evidence6641,2020-07-31 00:04:02
65,https://www.reddit.com/r/u_Responsible-One5860/comments/tqyein/gentrification_of_urban_areas/,Gentrification of Urban Areas,Urban renewal is often lauded as a blessing by politicians and land developers; it is seen as a method of bringing economic and cultural growth to an otherwise stagnant community.,[''],"['Urban', 'Areas']",gentrification of Urban Areas,Responsible-One5860,2022-03-29 17:43:49
66,https://www.reddit.com/r/u_CharacterMindless276/comments/sfbgws/gentrification_of_urban_areas/,Gentrification of Urban Areas,Urban renewal is often lauded as a blessing by politicians and land developers; it is seen as a method of bringing economic and cultural growth to an otherwise stagnant community.,[''],"['Urban', 'Areas']",gentrification of Urban Areas,CharacterMindless276,2022-01-29 11:30:00
67,https://www.reddit.com/r/u_Powerful-Business-94/comments/st7ib4/gentrification_of_urban_areas/,Gentrification of Urban Areas,Urban renewal is often lauded as a blessing by politicians and land developers; it is seen as a method of bringing economic and cultural growth to an otherwise stagnant community.,[''],"['Urban', 'Areas']",gentrification of Urban Areas,Powerful-Business-94,2022-02-15 22:26:35
68,http://www.lamag.com/longform/grand-central-market-gentrification/,Inside the Gentrification of Grand Central Market,,"['Inside', 'the']","['Grand', 'Central', 'Market']",gentrification of Grand Central Market,zsreport,2016-09-12 18:36:10
69,https://i.redd.it/hg2dxie4b1u61.jpg,What is Hemporium and the building it's located in a cover for? It's more dilapidated every time I walk passed. How has it survived the gentrification of 17th Ave?,,"['has', 'it', 'survived', 'the']","['17th', 'Ave?']",gentrification of 17th Ave?,LynseyLou92,2021-04-19 07:09:05
70,https://www.citylab.com/equity/2019/12/baltimore-development-chinatown-history-ethiopian-community/602941/?fbclid=IwAR069TQMh0g809cVDT_aUKe7qEbFXwk-oJAhJWNgY5C30c4Vx_fc5h60WjE,What Gentrification of Baltimore's Chinatown Means,,['What'],"['Baltimores', 'Chinatown', 'Means']",gentrification of Baltimores Chinatown Means,locker1313,2019-12-05 19:17:41
71,https://twitter.com/quintez_brown/status/1281654393712992256,Mayor Fischer was ran out of his press conference this morning Eyes... This comes after a lawsuit by Breonna Taylor’s family's attorneys alleging the search warrant that was issued for her house originated as part of a LMPD effort to aid in the gentrification of Black neighborhoods.,,"['to', 'aid', 'in', 'the']","['Black', 'neighborhoods.']",gentrification of Black neighborhoods.,3ustice3,2020-07-11 08:16:50
72,https://www.usatoday.com/videos/sports/2021/12/17/special-delivery-ma-maniere-airness-jordan-1-and-gentrification-sneakers/8929358002/,"[Sports] - Special Delivery: The A Ma Maniere ""Airness"" Jordan 1 and the gentrification of sneakers",,"['Jordan', '1', 'and', 'the']",['sneakers'],gentrification of sneakers,AutoNewsAdmin,2021-12-17 18:33:45
73,https://www.reddit.com/r/SanJose/comments/9k1bh8/the_gentrification_of_essj/,The Gentrification of ESSJ,"Is it only a matter of time before gentrification begins? Why hasn't it already? 

I know the area is mostly working class families and there isn't much of a vibrant culture when compared to other affected places like SF Mission or East LA but still... I wonder why the techies haven't began taking over the area given the housing issues in The Bay Area. Is it just that undesirable to outsiders? 

I'm a Mexican-American born and raised in ESSJ btw so I'm really just curious what the fate of my community might be.

Thoughts?",['The'],['ESSJ'],gentrification of ESSJ,ojkircy,2018-09-30 04:23:30
74,https://www.citylab.com/equity/2019/12/baltimore-development-chinatown-history-ethiopian-community/602941/,What Gentrification of Baltimore's Chinatown Means,,['What'],"['Baltimores', 'Chinatown', 'Means']",gentrification of Baltimores Chinatown Means,GovernorOfReddit,2019-12-06 07:47:00
75,https://www.reddit.com/r/circlejerk/comments/ndrz4q/gentrification_of_inner_city_areas_may_be_partly/,"Gentrification of inner city areas may be partly driven by the increasingly long hours of higher-income workers who move to city centers to cut commutes and demand less crime and more restaurants. The study found that by 1990, working longer hours became more common among the ""high-skilled"".",,[''],"['inner', 'city', 'areas', 'may']",gentrification of inner city areas may,Earl_Martinez,2021-05-16 21:58:18
76,https://www.reddit.com/r/u_Own-Grapefruit-2734/comments/sqovfq/gentrification_of_urban_areas/,Gentrification of Urban Areas,Urban renewal is often lauded as a blessing by politicians and land developers; it is seen as a method of bringing economic and cultural growth to an otherwise stagnant community.,[''],"['Urban', 'Areas']",gentrification of Urban Areas,Own-Grapefruit-2734,2022-02-12 16:14:54
77,https://www.reddit.com/r/u_Safe_Demand5569/comments/t1kc9p/gentrification_of_urban_areas/,Gentrification of Urban Areas,Urban renewal is often lauded as a blessing by politicians and land developers; it is seen as a method of bringing economic and cultural growth to an otherwise stagnant community.,[''],"['Urban', 'Areas']",gentrification of Urban Areas,Safe_Demand5569,2022-02-26 07:00:54
78,https://www.reddit.com/r/u_Affectionate_Arm2980/comments/t2jb6o/gentrification_of_urban_areas/,Gentrification of Urban Areas,Urban renewal is often lauded as a blessing by politicians and land developers; it is seen as a method of bringing economic and cultural growth to an otherwise stagnant community.,[''],"['Urban', 'Areas']",gentrification of Urban Areas,Affectionate_Arm2980,2022-02-27 13:33:09
79,https://www.reddit.com/r/u_Revolutionary_Job613/comments/t0ke2p/gentrification_of_urban_areas/,Gentrification of Urban Areas,Urban renewal is often lauded as a blessing by politicians and land developers; it is seen as a method of bringing economic and cultural growth to an otherwise stagnant community.,[''],"['Urban', 'Areas']",gentrification of Urban Areas,Revolutionary_Job613,2022-02-25 01:50:58
80,https://www.youtube.com/watch?v=xRm7EBanzok,[DISCUSSION] The Gentrification of Streetwear,,"['[DISCUSSION]', 'The']",['Streetwear'],gentrification of Streetwear,midnghttt,2020-06-11 03:55:08
81,https://www.reddit.com/r/u_Top_Touch7549/comments/svr0pt/gentrification_of_urban_areas/,Gentrification of Urban Areas,Urban renewal is often lauded as a blessing by politicians and land developers; it is seen as a method of bringing economic and cultural growth to an otherwise stagnant community.,[''],"['Urban', 'Areas']",gentrification of Urban Areas,Top_Touch7549,2022-02-19 01:32:49
82,https://www.youtube.com/watch?v=suV4AgCiiQs&ab_channel=JordanTheresa,The gentrification of depop | thoughts? do you agree with this video?,,['The'],"['depop', '|', 'thoughts?', 'do']",gentrification of depop | thoughts? do,dramentary,2021-02-18 23:01:13
83,https://www.reddit.com/r/unpopularopinion/comments/j4ba3y/policing_communities_that_you_dont_live_in_is_a/,Policing communities that you don’t live in is a form of displacement that leads to gentrification of communities by disrupting them.,"Calling the police on residents of a community/area when they’re causing no harm to you or others is a selfish thing to do and only causes disruption and displacement in the community that you’re visiting.

Edit: my opinion is that you suck if you do this.","['displacement', 'that', 'leads', 'to']","['communities', 'by', 'disrupting', 'them.']",gentrification of communities by disrupting them.,Hydromask,2020-10-03 12:20:51
84,https://www.nytimes.com/2021/12/05/opinion/gentrification-los-angeles-little-library.html?partner=IFTTT,Is My Little Library Contributing to the Gentrification of My Black Neighborhood?,,"['Library', 'Contributing', 'to', 'the']","['My', 'Black', 'Neighborhood?']",gentrification of My Black Neighborhood?,bobcat,2021-12-05 22:27:17
85,https://www.reddit.com/r/u_Ok-College2228/comments/sstg2f/gentrification_of_urban_areas/,Gentrification of Urban Areas,Urban renewal is often lauded as a blessing by politicians and land developers; it is seen as a method of bringing economic and cultural growth to an otherwise stagnant community.,[''],"['Urban', 'Areas']",gentrification of Urban Areas,Ok-College2228,2022-02-15 09:10:47
86,https://www.reddit.com/r/u_Happy_Foundation_182/comments/t2mjwd/gentrification_of_urban_areas/,Gentrification of Urban Areas,Urban renewal is often lauded as a blessing by politicians and land developers; it is seen as a method of bringing economic and cultural growth to an otherwise stagnant community.,[''],"['Urban', 'Areas']",gentrification of Urban Areas,Happy_Foundation_182,2022-02-27 17:16:24
87,https://www.reddit.com/r/u_Specialist_Street924/comments/segu8q/gentrification_of_urban_areas/,Gentrification of Urban Areas,Urban renewal is often lauded as a blessing by politicians and land developers; it is seen as a method of bringing economic and cultural growth to an otherwise stagnant community.,[''],"['Urban', 'Areas']",gentrification of Urban Areas,Specialist_Street924,2022-01-28 08:51:08
88,https://www.reddit.com/r/AskEconomics/comments/nk4yuy/when_gentrification_of_a_low_income_area_prices/,"When gentrification of a low income area prices out the previous residents, is there evidence to suggest local facilities improve as well (such as schooling)?",,['When'],"['a', 'low', 'income', 'area']",gentrification of a low income area,VanicFanboy,2021-05-25 00:09:47
89,https://www.reddit.com/r/u_Ecstatic-Tune-8641/comments/st889r/gentrification_of_urban_areas/,Gentrification of Urban Areas,Urban renewal is often lauded as a blessing by politicians and land developers; it is seen as a method of bringing economic and cultural growth to an otherwise stagnant community.,[''],"['Urban', 'Areas']",gentrification of Urban Areas,Ecstatic-Tune-8641,2022-02-15 22:57:16
90,https://www.reddit.com/r/Depop/comments/jslifl/the_gentrification_of_thrifting_hurting_lowincome/,the gentrification of thrifting hurting low-income people?,"hi guys! i know this has been a hot topic of controversy for a while, especially on tiktok. i'm writing an article about this for school and i need some quotes for it, so if you guys are willing to leave comments about your thoughts or if you're open to an interview, that'd be super cool!  thank you so much!",['the'],"['thrifting', 'hurting', 'low-income', 'people?']",gentrification of thrifting hurting low-income people?,quirkeys,2020-11-12 07:10:49
91,https://www.instagram.com/p/CRXNNi7LHPt/?utm_medium=copy_link,“The Gentrification of Giza” work in progress,,['“The'],"['Giza”', 'work', 'in', 'progress']",gentrification of Giza” work in progress,lavanceliningart,2021-07-16 04:00:37
92,https://www.reddit.com/r/whatstheword/comments/kptsjh/wtw_for_the_gentrification_of_rural_areas/,WTW for the gentrification of rural areas?,"Gentrification might not be an apt descriptor, but I’m basically trying to figure out how to describe the phenomenon of rural areas being turned into touristy destinations or resort areas for rich people at the expense of the people already living there. 

Like, what would be the word for rich people flooding an impoverished and rural community in an attempt at rebranding it and displacing the impoverished people already living there? I’ve seen rural gentrification thrown around and urbanization, but I’m not sure those quite fit what I’m looking for. Thanks!","['WTW', 'for', 'the']","['rural', 'areas?']",gentrification of rural areas?,fauxfoxem,2021-01-04 03:13:38
93,https://www.wral.com/-somewhere-better-to-live-residents-upset-over-gentrification-of-durham-neighborhood-/17702433/,'Somewhere better to live:' Residents upset over gentrification of Durham neighborhood,,"['live:', 'Residents', 'upset', 'over']","['Durham', 'neighborhood']",gentrification of Durham neighborhood,cons_NC,2018-07-17 08:17:43
94,https://twitter.com/MaxMMarin/status/979012828823736320,"In case y’all were wondering how the gentrification of the drug war was going, this quaint Kensington château offers a roof deck vista of four thriving heroin camps.",,"['were', 'wondering', 'how', 'the']","['the', 'drug', 'war', 'was']",gentrification of the drug war was,Wissahickon,2018-03-29 01:04:43
95,https://newsletter.fintechtakes.com/p/gentrification-deposits,The Gentrification of Deposits,,['The'],['Deposits'],gentrification of Deposits,four_fried_chickens,2021-07-14 07:01:47
96,https://forpositivepeaceblog.wordpress.com/2021/06/18/philadelphia-the-gentrification-of-progressive-politics/?fbclid=IwAR2-xpzc7mdeb6QkH9X6CEpyEeyUgOxyuz7aeekqxljhvB0SfumFNOhSlxg,Philadelphia: The Gentrification of Progressive Politics,,"['Philadelphia:', 'The']","['Progressive', 'Politics']",gentrification of Progressive Politics,forthetruth2019,2021-06-22 07:31:40
97,https://forpositivepeaceblog.wordpress.com/2021/06/18/philadelphia-the-gentrification-of-progressive-politics/?fbclid=IwAR2-xpzc7mdeb6QkH9X6CEpyEeyUgOxyuz7aeekqxljhvB0SfumFNOhSlxg,Philadelphia: The Gentrification of Progressive Politics,,"['Philadelphia:', 'The']","['Progressive', 'Politics']",gentrification of Progressive Politics,forthetruth2019,2021-06-22 07:26:15
98,https://www.nytimes.com/2021/12/05/opinion/gentrification-los-angeles-little-library.html,Opinion | Is My Little Library Contributing to the Gentrification of My Black Neighborhood?,,"['Library', 'Contributing', 'to', 'the']","['My', 'Black', 'Neighborhood?']",gentrification of My Black Neighborhood?,westcoasttechvegan,2021-12-15 03:16:38
99,https://www.reddit.com/r/CrazyIdeas/comments/344xnb/buy_land_in_africa_now_when_gentrification_of_the/,Buy land in Africa now. When gentrification of the whole planet happens you want to be able to stake your claim in an up-and-coming continent.,,"['in', 'Africa', 'now.', 'When']","['the', 'whole', 'planet', 'happens']",gentrification of the whole planet happens,randomwierd0,2015-04-28 15:14:01
100,https://www.reddit.com/r/TheForest/comments/ckvvqv/gentrification_of_the_forest_day_124/,Gentrification of The Forest: Day 124,"Timmy’s been dead about two months now. Project gentrification is coming along nicely with a zipline system connecting the two coasts over the lakes. 

Started blocking off the main village and have built a gazebo over the lake, with shelves for storage for weary visitors not far from the yacht.  Expansions expected even though the locals DO NOT like me taking over. It’s fine as their skulls make for glorious illumination at night. 

For weary travelers just off the plane, no need to worry. A quaint safety zone awaits with a treehouse walled off for those scared to explore. 

Up the hill from the plane is a turtle track that leads to the main village... perfect for those looking for more of a guided tour/jurassic park feel. 

If you are feeling adventurous, there are about 7 zones now complete with all you need to start your own town. 

If you are compelled to join in project gentrification, Im on ps4: screen name is Will_I_Mmm

Looking for fellow builders looking to completely gentrify the whole Forest. See ya there!",[''],"['The', 'Forest:', 'Day', '124']",gentrification of The Forest: Day 124,Will_I_Mmm,2019-08-02 04:40:25
101,https://youtu.be/n7aPR2Pnzgo,"DC Comics pushes wokeness to levels never before imagined in its new title, Harley Quinn: Breaking Glass which features a young Harley Quinn teaming up with a (now black) Poison Ivy to save a drag queen from the gentrification of an evil real estate developer.",,"['drag', 'queen', 'from', 'the']","['an', 'evil', 'real', 'estate']",gentrification of an evil real estate,PocketJacksComics,2019-08-21 02:55:45
102,https://www.reddit.com/r/Beastars/comments/fwibna/so_about_the_gentrification_of_the_back_market/,"So, about the gentrification of the Back Market...","We’re all aware of this, right? 

I see it, because I know how it starts. Some up and coming starts to streamline the whole thing, which only serves to flanderize the business into a parody of itself. That’s what happened to the Back Market.","['So', 'about', 'the']","['the', 'Back', 'Market...']",gentrification of the Back Market...,Lemanic89,2020-04-07 16:10:48
103,https://imgur.com/4A0fweD,Hope for the de-gentrification of the humble lentil?,,"['Hope', 'for', 'the', 'de-']","['the', 'humble', 'lentil?']",gentrification of the humble lentil?,MonotoneCreeper,2017-11-18 18:54:44
104,https://forpositivepeaceblog.wordpress.com/2021/06/18/philadelphia-the-gentrification-of-progressive-politics/?fbclid=IwAR2-xpzc7mdeb6QkH9X6CEpyEeyUgOxyuz7aeekqxljhvB0SfumFNOhSlxg,Philadelphia: The Gentrification of Progressive Politics,,"['Philadelphia:', 'The']","['Progressive', 'Politics']",gentrification of Progressive Politics,forthetruth2019,2021-06-22 07:30:20
105,https://mixmag.net/feature/the-gentrification-of-jungle,The Gentrification of Jungle [MixMag],,['The'],"['Jungle', '[MixMag]']",gentrification of Jungle [MixMag],cmonsquelch,2020-10-23 21:20:22
106,https://imgur.com/a/dEi9M,Interesting Article about the Gentrification of the South Wedge from 1982,,"['Interesting', 'Article', 'about', 'the']","['the', 'South', 'Wedge', 'from']",gentrification of the South Wedge from,mypetrobot,2017-12-01 06:59:52
107,https://spectator.us/gentrification-revolt-black-lives-matter-instagram/,The gentrification of revolt,,['The'],['revolt'],gentrification of revolt,ThePoliticalHat,2020-07-07 05:38:54
108,https://www.reddit.com/r/YangForPresidentHQ/comments/ccgiz4/a_thought_yang_should_talk_about_the_displacement/,A Thought: Yang should talk about the displacement and gentrification of people by wealthy tech workers too.,"Technology is coming. Automation is coming. We already know that technology and automation is going to replace tons and tons of working Americans. But I think Yang we should also talk about how wealthy high earning tech employees (that are making these technology) are driving out tons and tons of working class and middle class people from cities, like San Francisco Bay Area, where rent is on average 3.6K/month for a 1 bedroom. 

Tech companies are also spreading to other major cities and increasing the rent prices there as well. This is a serious topic I hope Yang can bring in order to further prove the reasoning for a UBI. 

**UBI will not only help those replaced by tech, it will help those being displaced by tech workers too.**","['about', 'the', 'displacement', 'and']","['people', 'by', 'wealthy', 'tech']",gentrification of people by wealthy tech,Yangsta2020,2019-07-13 02:25:59
109,https://youtube.com/watch?v=suV4AgCiiQs&feature=share,the gentrification of depop,,['the'],['depop'],gentrification of depop,queer_artsy_kid,2021-02-11 10:01:18
110,https://www.houstonchronicle.com/news/houston-texas/houston/article/People-of-color-drove-Houston-s-growth-but-16417032.php,"'A crisis': Census figures reflect gentrification of Houston's historic Black, brown neighborhoods [paywall]",,"['crisis:', 'Census', 'figures', 'reflect']","['Houstons', 'historic', 'Black', 'brown']",gentrification of Houstons historic Black brown,QueeLinx,2021-08-28 03:39:54
111,http://i.imgur.com/WHZrR3F.jpg,I have decided to throw this garbage down to protest the gentrification of my backyard. Seems like the thing to do these days.,,"['down', 'to', 'protest', 'the']","['my', 'backyard.', 'Seems', 'like']",gentrification of my backyard. Seems like,ConcreteClown,2013-03-22 05:15:04
112,https://i.redd.it/04bacn3me5s41.jpg,The controversial gentrification of Wynwood.,,"['The', 'controversial']",['Wynwood.'],gentrification of Wynwood.,merlissah,2020-04-11 13:49:47
113,https://www.reddit.com/r/shittysocialscience/comments/9ruvtr/what_are_the_factors_that_have_lead_to_the/,What are the factors that have lead to the gentrification of Sesame Street,,"['have', 'lead', 'to', 'the']","['Sesame', 'Street']",gentrification of Sesame Street,driftersgold,2018-10-27 20:31:53
114,https://youtu.be/suV4AgCiiQs,the gentrification of depop,,['the'],['depop'],gentrification of depop,iloomynazi,2020-11-28 20:13:18
115,https://youtu.be/rZhE6wiKFtc,I wrote a song about the gentrification of Midtown,,"['a', 'song', 'about', 'the']",['Midtown'],gentrification of Midtown,professordaylover,2019-09-23 02:58:13
116,https://theundefeated.com/features/gentrification-of-ncaa-division-1-college-basketball/,The Gentrification of College Hoops,,['The'],"['College', 'Hoops']",gentrification of College Hoops,bayisdub,2017-03-19 01:22:24
